{
  "meta": {
    "fund_id": "fund-a",
    "run_date": "2026-04-16",
    "generated_at": "2026-04-16T06:58:01.527Z",
    "pack_version": "v1"
  },
  "symbols": {
    "candidates": [
      "AAPL",
      "AMZN",
      "AVGO",
      "COST",
      "CVX",
      "GOOGL",
      "IBIT",
      "JPM",
      "KLAC",
      "LLY",
      "LMT",
      "META",
      "MSFT",
      "NOW",
      "NVDA",
      "NVO",
      "PANW",
      "PLTR",
      "SLV",
      "TSM",
      "V",
      "XLI",
      "XOM",
      "GLD",
      "BTC-USD",
      "ETH-USD"
    ],
    "benchmarks": [
      "SPY",
      "QQQ",
      "IWM",
      "TLT",
      "GLD",
      "BTC-USD"
    ],
    "required": [
      "SPY",
      "QQQ",
      "IWM",
      "TLT",
      "GLD",
      "BTC-USD",
      "NVDA",
      "GOOGL",
      "XOM",
      "CVX",
      "TSM",
      "AVGO",
      "KLAC",
      "COST"
    ],
    "previous_holdings": [
      "NVDA",
      "GOOGL",
      "XOM",
      "CVX",
      "TSM",
      "AVGO",
      "KLAC",
      "COST"
    ]
  },
  "quality": {
    "status": "ok",
    "yahoo_symbol_count": 30,
    "yahoo_success_count": 30,
    "yahoo_error_count": 0,
    "required_symbol_coverage": {
      "required_count": 14,
      "available_count": 14,
      "missing_count": 0,
      "missing_symbols": []
    },
    "benchmark_coverage": {
      "required_count": 6,
      "available_count": 6,
      "missing_count": 0,
      "missing_symbols": []
    },
    "warnings": [
      "Trimmed live run_date crypto bars for deterministic cross-lane parity: BTC-USD, ETH-USD"
    ],
    "errors": []
  },
  "market_data": {
    "AMZN": {
      "ticker": "AMZN",
      "yahoo_symbol": "AMZN",
      "name": "Amazon.com, Inc.",
      "currency": "USD",
      "exchange": "NMS",
      "instrument_type": "EQUITY",
      "bars_available": 310,
      "latest_bar_date": "2026-04-15",
      "last_close": 248.5,
      "features": {
        "return_1w_pct": 12.316,
        "return_1m_pct": 17.361,
        "return_3m_pct": 2.432,
        "return_6m_pct": 12.919,
        "return_12m_pct": 34.419,
        "ma_20": 217.339,
        "ma_50": 213.671,
        "ma_200": 225.2825,
        "above_ma_50": true,
        "above_ma_200": true,
        "vol_20d_annualized_pct": 36.871,
        "max_drawdown_63d_pct": -18.755,
        "max_drawdown_252d_pct": -21.736,
        "momentum_composite_pct": 16.783
      },
      "fetch_status": "success"
    },
    "AVGO": {
      "ticker": "AVGO",
      "yahoo_symbol": "AVGO",
      "name": "Broadcom Inc.",
      "currency": "USD",
      "exchange": "NMS",
      "instrument_type": "EQUITY",
      "bars_available": 310,
      "latest_bar_date": "2026-04-15",
      "last_close": 396.72,
      "features": {
        "return_1w_pct": 13.145,
        "return_1m_pct": 22.354,
        "return_3m_pct": 12.11,
        "return_6m_pct": 11.666,
        "return_12m_pct": 119.817,
        "ma_20": 331.3855,
        "ma_50": 329.4426,
        "ma_200": 330.7289,
        "above_ma_50": true,
        "above_ma_200": true,
        "vol_20d_annualized_pct": 45.71,
        "max_drawdown_63d_pct": -16.401,
        "max_drawdown_252d_pct": -28.666,
        "momentum_composite_pct": 41.487
      },
      "fetch_status": "success"
    },
    "AAPL": {
      "ticker": "AAPL",
      "yahoo_symbol": "AAPL",
      "name": "Apple Inc.",
      "currency": "USD",
      "exchange": "NMS",
      "instrument_type": "EQUITY",
      "bars_available": 310,
      "latest_bar_date": "2026-04-15",
      "last_close": 266.43,
      "features": {
        "return_1w_pct": 2.908,
        "return_1m_pct": 5.383,
        "return_3m_pct": 2.156,
        "return_6m_pct": 7.784,
        "return_12m_pct": 35.045,
        "ma_20": 254.6495,
        "ma_50": 260.7906,
        "ma_200": 251.2184,
        "above_ma_50": true,
        "above_ma_200": true,
        "vol_20d_annualized_pct": 21.157,
        "max_drawdown_63d_pct": -11.239,
        "max_drawdown_252d_pct": -13.799,
        "momentum_composite_pct": 12.592
      },
      "fetch_status": "success"
    },
    "GOOGL": {
      "ticker": "GOOGL",
      "yahoo_symbol": "GOOGL",
      "name": "Alphabet Inc.",
      "currency": "USD",
      "exchange": "NMS",
      "instrument_type": "EQUITY",
      "bars_available": 310,
      "latest_bar_date": "2026-04-15",
      "last_close": 337.12,
      "features": {
        "return_1w_pct": 6.24,
        "return_1m_pct": 10.329,
        "return_3m_pct": 0.413,
        "return_6m_pct": 38.267,
        "return_12m_pct": 115.279,
        "ma_20": 302.9285,
        "ma_50": 307.6721,
        "ma_200": 270.6013,
        "above_ma_50": true,
        "above_ma_200": true,
        "vol_20d_annualized_pct": 36.891,
        "max_drawdown_63d_pct": -20.366,
        "max_drawdown_252d_pct": -20.366,
        "momentum_composite_pct": 41.072
      },
      "fetch_status": "success"
    },
    "IBIT": {
      "ticker": "IBIT",
      "yahoo_symbol": "IBIT",
      "name": "iShares Bitcoin Trust ETF",
      "currency": "USD",
      "exchange": "NGM",
      "instrument_type": "ETF",
      "bars_available": 310,
      "latest_bar_date": "2026-04-15",
      "last_close": 42.56,
      "features": {
        "return_1w_pct": 5.294,
        "return_1m_pct": 1.478,
        "return_3m_pct": -20.553,
        "return_6m_pct": -35.329,
        "return_12m_pct": -10.72,
        "ma_20": 39.8035,
        "ma_50": 39.4411,
        "ma_200": 54.5278,
        "above_ma_50": true,
        "above_ma_200": false,
        "vol_20d_annualized_pct": 35.907,
        "max_drawdown_63d_pct": -34.885,
        "max_drawdown_252d_pct": -49.362,
        "momentum_composite_pct": -16.281
      },
      "fetch_status": "success"
    },
    "COST": {
      "ticker": "COST",
      "yahoo_symbol": "COST",
      "name": "Costco Wholesale Corporation",
      "currency": "USD",
      "exchange": "NMS",
      "instrument_type": "EQUITY",
      "bars_available": 310,
      "latest_bar_date": "2026-04-15",
      "last_close": 984.75,
      "features": {
        "return_1w_pct": -4.418,
        "return_1m_pct": -1.696,
        "return_3m_pct": 4.689,
        "return_6m_pct": 5.551,
        "return_12m_pct": 2.775,
        "ma_20": 992.1205,
        "ma_50": 994.2776,
        "ma_200": 947.4189,
        "above_ma_50": false,
        "above_ma_200": true,
        "vol_20d_annualized_pct": 18.883,
        "max_drawdown_63d_pct": -5.545,
        "max_drawdown_252d_pct": -19.347,
        "momentum_composite_pct": 2.83
      },
      "fetch_status": "success"
    },
    "CVX": {
      "ticker": "CVX",
      "yahoo_symbol": "CVX",
      "name": "Chevron Corporation",
      "currency": "USD",
      "exchange": "NYQ",
      "instrument_type": "EQUITY",
      "bars_available": 310,
      "latest_bar_date": "2026-04-15",
      "last_close": 184.91,
      "features": {
        "return_1w_pct": -4.137,
        "return_1m_pct": -6.061,
        "return_3m_pct": 13.943,
        "return_6m_pct": 24.262,
        "return_12m_pct": 42.469,
        "ma_20": 199.3885,
        "ma_50": 191.3396,
        "ma_200": 161.9596,
        "above_ma_50": false,
        "above_ma_200": true,
        "vol_20d_annualized_pct": 29.352,
        "max_drawdown_63d_pct": -12.427,
        "max_drawdown_252d_pct": -12.427,
        "momentum_composite_pct": 18.653
      },
      "fetch_status": "success"
    },
    "JPM": {
      "ticker": "JPM",
      "yahoo_symbol": "JPM",
      "name": "JPMorgan Chase & Co.",
      "currency": "USD",
      "exchange": "NYQ",
      "instrument_type": "EQUITY",
      "bars_available": 310,
      "latest_bar_date": "2026-04-15",
      "last_close": 305.93,
      "features": {
        "return_1w_pct": -0.662,
        "return_1m_pct": 7.456,
        "return_3m_pct": -1.095,
        "return_6m_pct": 0.296,
        "return_12m_pct": 32.041,
        "ma_20": 295.8214,
        "ma_50": 298.3336,
        "ma_200": 300.5888,
        "above_ma_50": true,
        "above_ma_200": true,
        "vol_20d_annualized_pct": 23.622,
        "max_drawdown_63d_pct": -12.27,
        "max_drawdown_252d_pct": -15.472,
        "momentum_composite_pct": 9.675
      },
      "fetch_status": "success"
    },
    "NOW": {
      "ticker": "NOW",
      "yahoo_symbol": "NOW",
      "name": "ServiceNow, Inc.",
      "currency": "USD",
      "exchange": "NYQ",
      "instrument_type": "EQUITY",
      "bars_available": 310,
      "latest_bar_date": "2026-04-15",
      "last_close": 94.19,
      "features": {
        "return_1w_pct": -3.365,
        "return_1m_pct": -18.01,
        "return_3m_pct": -31.84,
        "return_6m_pct": -49.015,
        "return_12m_pct": -40.058,
        "ma_20": 100.946,
        "ma_50": 106.1634,
        "ma_200": 156.3253,
        "above_ma_50": false,
        "above_ma_200": false,
        "vol_20d_annualized_pct": 63.767,
        "max_drawdown_63d_pct": -39.123,
        "max_drawdown_252d_pct": -60.275,
        "momentum_composite_pct": -34.731
      },
      "fetch_status": "success"
    },
    "META": {
      "ticker": "META",
      "yahoo_symbol": "META",
      "name": "Meta Platforms, Inc.",
      "currency": "USD",
      "exchange": "NMS",
      "instrument_type": "EQUITY",
      "bars_available": 310,
      "latest_bar_date": "2026-04-15",
      "last_close": 671.58,
      "features": {
        "return_1w_pct": 9.66,
        "return_1m_pct": 7.033,
        "return_3m_pct": 6.507,
        "return_6m_pct": -6.008,
        "return_12m_pct": 23.935,
        "ma_20": 596.5355,
        "ma_50": 629.4424,
        "ma_200": 680.7045,
        "above_ma_50": true,
        "above_ma_200": false,
        "vol_20d_annualized_pct": 51.755,
        "max_drawdown_63d_pct": -28.733,
        "max_drawdown_252d_pct": -33.297,
        "momentum_composite_pct": 7.867
      },
      "fetch_status": "success"
    },
    "KLAC": {
      "ticker": "KLAC",
      "yahoo_symbol": "KLAC",
      "name": "KLA Corporation",
      "currency": "USD",
      "exchange": "NMS",